{
  "component_name": "saint_malachie_gisoo",
  "mode": "independent",
  "fsa": null,
  "workflow_output_path": "/data/output/saint_malachie_gisoo_with_fsa/saint_malachie_gisoo_with_fsa.shp",
  "standardized_output_path": null,
  "cleaned_output_paths": [],
  "standardized_artifact_id": null,
  "standardized_download_url": null
}
